{
  "project_root": ".",
  "generated_at": "2026-09-29",
  "generated_by": "CORPUS_AGENT (performed by the author agent)",
  "items": [
    {
      "id": "E001",
      "kind": "method_detail",
      "summary": "The suite has four benchmarks: keyword spotting, visual wake words, image classification, anomaly detection.",
      "locator": {
        "path": "project/paper.txt",
        "anchor": "line 10 (abstract, last sentence)"
      },
      "strength": "hard",
      "status": "ok",
      "value": {
        "n_benchmarks": 4
      },
      "notes": "Quote: \"The suite features four benchmarks: keyword spotting, visual wake words, image classification, and anomaly detection.\""
    },
    {
      "id": "E002",
      "kind": "observation",
      "summary": "The suite is described as a collaborative effort of more than 50 organizations from industry and academia; the four benchmarks were selected by more than 50 organizations.",
      "locator": {
        "path": "project/paper.txt",
        "anchor": "lines 10 and 18"
      },
      "strength": "hard",
      "status": "ok",
      "value": {
        "organizations": "more than 50"
      },
      "notes": "Quote: \"collaborative effort of more than 50 organizations from industry and academia\"; \"a set of four standard benchmarks, selected by more than 50 organizations in academia and industry\".",
      "quantity": "num_organizations"
    },
    {
      "id": "E003",
      "kind": "method_detail",
      "summary": "The suite measures accuracy, latency and energy of ML inference; the reference implementations include training scripts, pre-trained models and C code, and are open source.",
      "locator": {
        "path": "project/paper.txt",
        "anchor": "lines 10, 18, 36"
      },
      "strength": "hard",
      "status": "ok",
      "notes": "Quote: \"MLPerf Tiny measures the accuracy, latency, and energy of machine learning inference\"; \"each benchmark has a reference implementation that includes training scripts, pre-trained models, and C code implementations\"."
    },
    {
      "id": "E004",
      "kind": "dataset",
      "summary": "Table 1 row, keyword spotting: Speech Commands dataset, input size 49x10, DS-CNN model (TFLite size 52.5 KB), quality target 90% (Top-1).",
      "locator": {
        "path": "project/paper.txt",
        "anchor": "lines 39-50 (Table 1, damaged extraction; column order preserved)"
      },
      "strength": "hard",
      "status": "ok",
      "value": {
        "task": "Keyword Spotting",
        "dataset": "Speech Commands",
        "input_size": "49x10",
        "model": "DS-CNN",
        "tflite_size": "52.5 KB",
        "quality_target": "90% (Top-1)"
      },
      "notes": "Table 1 extraction lists columns in order: Use Case (KWS, VWW, IC, AD); Dataset (Input Size); Model (TFLite Model Size); Quality Target (Metric). Row alignment follows the order of the lists; the per-task text in section 4 confirms the target values 80%, 85%, 90%, AUC 0.85 and the sizes 325 KB and 96 KB.",
      "quantity": "table1_kws"
    },
    {
      "id": "E005",
      "kind": "dataset",
      "summary": "Table 1 row, visual wake words: VWW dataset, input size 96x96, MobileNetV1 (325 KB), quality target 80% (Top-1).",
      "locator": {
        "path": "project/paper.txt",
        "anchor": "lines 39-50 (Table 1)"
      },
      "strength": "hard",
      "status": "ok",
      "value": {
        "task": "Visual Wake Words",
        "dataset": "VWW Dataset",
        "input_size": "96x96",
        "model": "MobileNetV1",
        "tflite_size": "325 KB",
        "quality_target": "80% (Top-1)"
      },
      "notes": "Text section 4.1 confirms MobileNetV1, 325KB and the 80% closed-division target.",
      "quantity": "table1_vww"
    },
    {
      "id": "E006",
      "kind": "dataset",
      "summary": "Table 1 row, image classification: CIFAR10, input size 32x32, ResNet (96 KB), quality target 85% (Top-1).",
      "locator": {
        "path": "project/paper.txt",
        "anchor": "lines 39-50 (Table 1)"
      },
      "strength": "hard",
      "status": "ok",
      "value": {
        "task": "Image Classification",
        "dataset": "CIFAR10",
        "input_size": "32x32",
        "model": "ResNet",
        "tflite_size": "96 KB",
        "quality_target": "85% (Top-1)"
      },
      "notes": "Text section 4.2 confirms 96KB and 85% top-1.",
      "quantity": "table1_ic"
    },
    {
      "id": "E007",
      "kind": "dataset",
      "summary": "Table 1 row, anomaly detection: ToyADMOS, input size 5*128, FC-AutoEncoder (270 KB), quality target .85 (AUC).",
      "locator": {
        "path": "project/paper.txt",
        "anchor": "lines 39-50 (Table 1)"
      },
      "strength": "hard",
      "status": "ok",
      "value": {
        "task": "Anomaly Detection",
        "dataset": "ToyADMOS",
        "input_size": "5*128",
        "model": "FC-AutoEncoder",
        "tflite_size": "270 KB",
        "quality_target": ".85 (AUC)"
      },
      "notes": "Text section 4.4 gives the model input size as 640 (five frames of 128 bands) and the AUC 0.85 threshold. The 270 KB size appears only in Table 1.",
      "quantity": "table1_ad"
    },
    {
      "id": "E008",
      "kind": "dataset",
      "summary": "Visual wake words: MSCOCO 2014 is used for training, validation and test; images contain at least one person occupying more than 2.5% of the source image; resized to 96x96; MobileNetV1 with alpha 0.25 and two output classes (person, no person); TFLM model 325KB.",
      "locator": {
        "path": "project/paper.txt",
        "anchor": "lines 53-55 (section 4.1)"
      },
      "strength": "hard",
      "status": "ok",
      "value": {
        "train_val_test": "MSCOCO 2014",
        "min_person_area": "2.5%",
        "image_size": "96x96",
        "alpha": 0.25,
        "classes": 2,
        "model_size": "325KB"
      },
      "notes": "Quote: \"preprocessed to train on image which contain at least one person occupying more than 2.5% of the source image. Images are also resized to 96x96\"; \"alpha of 0.25 and two output classes (person and no person). The TFLM model is 325KB in size.\""
    },
    {
      "id": "E009",
      "kind": "result",
      "summary": "VWW reference model reaches about 86% accuracy across the preprocessed MSCOCO 2014 test dataset; closed-division submissions should reach at least 80% accuracy.",
      "locator": {
        "path": "project/paper.txt",
        "anchor": "line 56 (section 4.1, Quality Target)"
      },
      "strength": "hard",
      "status": "ok",
      "value": {
        "metric": "accuracy",
        "reference": "about 86%",
        "quality_target": "80%"
      },
      "conditions": "preprocessed MSCOCO 2014 test dataset; based on validation and training accuracy per the authors",
      "notes": "Quote: \"the model reaches about 86% accuracy across the preprocessed MSCOCO 2014 test dataset\"; \"submissions to the closed category should reach at least 80% accuracy across the same dataset.\"",
      "quantity": "vww_reference_accuracy"
    },
    {
      "id": "E010",
      "kind": "dataset",
      "summary": "Image classification: CIFAR-10 has 60000 32x32x3 RGB images with 6000 images per class, 10 classes, five training batches and one testing batch of 10000 images each; the model is a customized ResNetv1 with three residual stacks instead of four, no pooling after the first convolutional layer, fewer filters and lower strides; TFLite model 96KB.",
      "locator": {
        "path": "project/paper.txt",
        "anchor": "lines 59-60 (section 4.2)"
      },
      "strength": "hard",
      "status": "ok",
      "value": {
        "images": 60000,
        "per_class": 6000,
        "classes": 10,
        "batches": "five training batches and one testing batch, each with 10000 images",
        "residual_stacks": "three (official ResNet: four)",
        "model_size": "96KB"
      },
      "notes": "Quote: \"60000 32x32x3 RGB images, with 6000 images per class\"; \"three compared to four\"; \"The TFLite model for IC is 96KB in size\"."
    },
    {
      "id": "E011",
      "kind": "result",
      "summary": "IC reference model reaches 86.5% accuracy across 200 test images selected from the CIFAR-10 test set; quality target set to 85% top-1 accuracy.",
      "locator": {
        "path": "project/paper.txt",
        "anchor": "lines 61-64 (section 4.2, Quality Target)"
      },
      "strength": "hard",
      "status": "ok",
      "value": {
        "metric": "top-1 accuracy",
        "reference": "86.5%",
        "quality_target": "85%",
        "n_images": 200
      },
      "conditions": "200 images of the CIFAR-10 test set, evaluated with the benchmark framework runner",
      "notes": "Quote: \"A set of 200 images from the CIFAR-10 test set are selected\"; \"The model reaches 86.5% accuracy\" ... \"across the 200 testing raw images.\"; \"we set the quality target to 85% top-1 accuracy.\"",
      "quantity": "ic_reference_accuracy"
    },
    {
      "id": "E012",
      "kind": "dataset",
      "summary": "Keyword spotting data: Speech Commands v2, 105,829 utterances from 2,618 speakers, 30 words plus background noises, split so that each speaker appears in one subset; 10 words used, the remaining 20 words combined with background noise as an open-set 'unknown' class; with 'silence' this gives 12 output classes.",
      "locator": {
        "path": "project/paper.txt",
        "anchor": "line 67 (section 4.3)"
      },
      "strength": "hard",
      "status": "ok",
      "value": {
        "utterances": 105829,
        "speakers": 2618,
        "words": 30,
        "words_used": 10,
        "output_classes": 12
      },